{
  "$schema": "./registry.schema.json",
  "name": "Titan Design System Registry",
  "version": "0.10.0",
  "description": "Machine-readable index of the design system's components, patterns, data-visualization contracts and directions. An agent should read this before writing any UI and update it in the same change that adds a system primitive. Extracted from App Redesign/index_prodRedesign_interactions.html.",
  "conventions": {
    "idiom": "Plain CSS classes plus optional JS render modules — no build step, no framework, no TypeScript. A component is a stylesheet, and a function returning an HTML string where composition earns one. This is the same pattern titan-sidebar.js and form-render.js already use in production.",
    "consume": "<link> the two token files, then the component stylesheet, then <script> the module if there is one. Order matters: primitives, semantics, theme, components.",
    "classPrefix": "ds-",
    "variantClass": ".ds-<component>--<variant>",
    "tokensOnly": "A component stylesheet may not contain a raw hex or a raw px for anything themeable. If a value is missing, add a token to tokens/semantics.css rather than hardcoding it here.",
    "visualizationModule": "components/visualization.js owns fluid shared chart layouts, sm/md/lg internal sizing, the optional fill-card layout and categorical colour order used by both workbench specimens and product renderers.",
    "workbench": "/design-system/index.html renders every component in every state, every registered pattern, canonical data-visualization components, and a live direction switcher. Screenshot the relevant view after any change."
  },
  "tokens": {
    "primitives": "tokens/primitives.css",
    "semantics": "tokens/semantics.css",
    "themes": "themes/",
    "rule": "Components read semantics only. Primitives are raw values; a theme remaps semantics onto them."
  },
  "themes": [
    {
      "id": "default",
      "name": "Default",
      "file": "themes/default.css",
      "description": "The look extracted from the redesign — every semantic already holds these values."
    },
    {
      "id": "soft",
      "name": "Soft",
      "file": "themes/soft.css",
      "description": "Rounder controls, borderless cards, elevation doing all the separating."
    }
  ],
  "patterns": [
    {
      "id": "modal-dialog",
      "name": "Modal dialog",
      "category": "Interaction & layout",
      "visual": "modal-overlay",
      "summary": "A temporary, focused layer over the current page. The originating context remains visible but inactive beneath the design-system-controlled backdrop.",
      "useWhen": "Use for a short, bounded task that benefits from retaining the current page as context and can be completed or dismissed without navigating through multiple sections.",
      "route": "No route — opens over the current page",
      "structure": [
        "A full-viewport backdrop dims and disables the originating page.",
        "A focused panel contains a clear header, scrollable body when needed, and action footer.",
        "The header names the task and provides an explicit close action.",
        "The footer presents one primary action and only the secondary actions the task needs."
      ],
      "requirements": [
        "Use --modal-backdrop-bg for the scrim; never introduce a page-specific black overlay.",
        "Expose role=dialog, aria-modal=true, and an accessible name.",
        "Move focus into the dialog, contain keyboard focus while open, and return focus to the trigger on close.",
        "Support Escape to close unless closing would discard a destructive operation without confirmation.",
        "Lock background scrolling and keep the page beneath non-interactive.",
        "Keep controls inside the dialog on registered design-system components.",
        "For new implementations, use the shared --pattern-content-inset-x / --pattern-content-inset-y, --pattern-item-gap, --pattern-section-gap and --pattern-action-gap roles where the anatomy applies. Record page-specific geometry exceptions; existing pages require explicit adoption."
      ],
      "avoid": [
        "Do not use for multi-section settings, deep navigation, or work that needs a durable URL.",
        "Do not stack routine dialogs; move the task to a full-page pattern when it outgrows one layer.",
        "Do not use a modal as a substitute for a cold-loadable destination."
      ],
      "examples": [
        "crm.html — New pipeline and Add team",
        "opportunity-view.html — email and meeting details",
        "pipeline-settings.html — incoming-email and delete confirmations"
      ],
      "anatomy": {
        "specimen": ".wb-pattern-modal",
        "parts": [
          {
            "name": "Header",
            "selector": ".wb-pattern-modalhead"
          },
          {
            "name": "Scrollable body",
            "selector": ".wb-pattern-modalbody"
          },
          {
            "name": "Actions",
            "selector": ".wb-pattern-modalfoot"
          }
        ],
        "spacing": [
          {
            "label": "Shared horizontal inset · left",
            "token": "--pattern-content-inset-x",
            "selector": ".wb-pattern-modalhead, .wb-pattern-modalfoot",
            "property": "padding-left",
            "note": ""
          },
          {
            "label": "Shared horizontal inset · right",
            "token": "--pattern-content-inset-x",
            "selector": ".wb-pattern-modalhead, .wb-pattern-modalfoot",
            "property": "padding-right",
            "note": ""
          },
          {
            "label": "Shared horizontal inset · top",
            "token": "--pattern-content-inset-y",
            "selector": ".wb-pattern-modalhead, .wb-pattern-modalfoot",
            "property": "padding-top",
            "note": ""
          },
          {
            "label": "Shared horizontal inset · bottom",
            "token": "--pattern-content-inset-y",
            "selector": ".wb-pattern-modalhead, .wb-pattern-modalfoot",
            "property": "padding-bottom",
            "note": ""
          },
          {
            "label": "Body inset · left",
            "token": "--pattern-content-inset-x",
            "selector": ".wb-pattern-modalbody",
            "property": "padding-left",
            "note": ""
          },
          {
            "label": "Body inset · right",
            "token": "--pattern-content-inset-x",
            "selector": ".wb-pattern-modalbody",
            "property": "padding-right",
            "note": ""
          },
          {
            "label": "Body inset · top",
            "token": "--pattern-content-inset-y",
            "selector": ".wb-pattern-modalbody",
            "property": "padding-top",
            "note": ""
          },
          {
            "label": "Body inset · bottom",
            "token": "--pattern-content-inset-y",
            "selector": ".wb-pattern-modalbody",
            "property": "padding-bottom",
            "note": ""
          },
          {
            "label": "Body items",
            "token": "--pattern-item-gap",
            "selector": ".wb-pattern-modalbody",
            "property": "row-gap",
            "note": ""
          },
          {
            "label": "Action gap",
            "token": "--pattern-action-gap",
            "selector": ".wb-pattern-modalfoot",
            "property": "column-gap",
            "note": ""
          }
        ],
        "alignment": "Header, body and footer share a content edge. Actions align to the trailing edge.",
        "behavior": "Body scrolls when bounded by the viewport; header and actions stay outside that scroll region. The specimen illustrates layout, not focus trapping or dismissal.",
        "ownership": "Each region owns one inset. Adjacent inset regions and dividers provide separation; do not add a second stack gap. Page owns dialog width, height limit and accessible behavior.",
        "implementation": "pattern-specimen"
      }
    },
    {
      "id": "full-page-settings",
      "name": "Full-page settings",
      "category": "Navigation & layout",
      "visual": "sidebar-workspace",
      "summary": "A standalone settings destination that replaces Titan's global CRM sidebar and owns the full task workspace at a durable route. It is never a modal, drawer, or layer over the originating screen.",
      "useWhen": "Use for configuration with multiple sections, substantial editing, or its own navigation context—work that benefits from a durable URL and the full workspace width.",
      "route": "/crm/pipeline/:id/setting",
      "structure": [
        "A full-width task header provides Back, the settings scope, status, and page actions.",
        "The global CRM sidebar is absent so the settings task owns the complete viewport.",
        "A multi-section task may add one local settings rail below the task header; a single-section task uses the full width.",
        "Sections flow in the page rather than being split across stacked modals."
      ],
      "requirements": [
        "The route must survive a cold load and preserve ?u=<persona>.",
        "Fetch required data on the page; do not depend on a previous document having stashed it.",
        "Do not mount or load titan-sidebar.js on the settings page; titan-sidebar.css may still provide the shared page shell.",
        "If the task needs section navigation, keep it local to the settings page and below the full-width header.",
        "Navigate in place. Do not depend on window.opener.",
        "Keep page-specific CSS to workspace layout and compose controls from registered design-system components.",
        "For new implementations, use the shared --pattern-content-inset-x / --pattern-content-inset-y, --pattern-item-gap, --pattern-section-gap and --pattern-action-gap roles where the anatomy applies. Record page-specific geometry exceptions; existing pages require explicit adoption."
      ],